{
  "$schema": "./schemas/estimate.schema.json",
  "$depends_on": [
    "requirements.json",
    "architecture.json",
    "data_model.json",
    "security_review.json"
  ],
  "engagement_id": "eng-2026-003",
  "version": "2.1",
  "last_updated": "2026-03-19",
  "status": "complete",
  "currency": "USD",
  "methodology": "three_point",
  "confidence_level": "medium",
  "complexity_rating": "medium",
  "complexity_factors": [
    "Bedrock model access no longer requires manual console enablement \u2014 Amazon models (Nova Canvas, Titan V2) auto-enable on first invocation; Anthropic Claude Sonnet 4.6 requires aws-marketplace:Subscribe in IAM for auto-enablement",
    "Pillow text overlay coordinate tuning per aspect ratio requires iterative refinement \u00e2\u20ac\u201d AI-assisted but may need multiple passes",
    "Claude Code skill scaffolding (8 skills + hooks + .mcp.json) adds scope vs. v1.0 CLI approach, offset by lower per-skill complexity",
    "GitHub Actions CI/CD with OIDC or Secrets configuration adds new scope vs. v1.0 (was out-of-scope)",
    "All development hours are AI-assisted (Claude Code + Sonnet) \u00e2\u20ac\u201d not raw human labor. 3-5\u00c3\u2014 multiplier over manual for boilerplate; ~1\u00c3\u2014 for novel problem-solving (Pillow coordinates, prompt engineering)"
  ],
  "complexity_assessment": {
    "score": 4,
    "max_score": 10,
    "rating": "medium",
    "buffer_percent": 25,
    "factors": {
      "novel_technology_stack": {
        "score": 1,
        "note": "Bedrock image generation (Nova Canvas) and AnthropicBedrock text client are relatively new API patterns"
      },
      "multiple_integrations": {
        "score": 1,
        "note": "3 integrations: S3 + Bedrock image generation + Bedrock text reasoning \u00e2\u20ac\u201d just above 2-integration baseline"
      },
      "high_performance_requirements": {
        "score": 0,
        "note": "P95 60s/image target, 1 concurrent user \u00e2\u20ac\u201d trivially achievable"
      },
      "data_pipeline_complexity": {
        "score": 0,
        "note": "Linear pipeline with clear inputs/outputs \u00e2\u20ac\u201d no branching, streaming, or fan-out"
      },
      "unfamiliar_tech_stack": {
        "score": 1,
        "note": "Claude Code custom skills scaffold plus AnthropicBedrock client are new additions vs. v1.0"
      },
      "evolving_requirements": {
        "score": 0,
        "note": "Well-defined PoC scope with explicit acceptance criteria \u00e2\u20ac\u201d requirements locked at v2.0"
      },
      "critical_external_dependencies": {
        "score": 2,
        "note": "Bedrock console enablement retired \u2014 Amazon models auto-enable on first invocation. Claude Sonnet 4.6 needs aws-marketplace:Subscribe in IAM policy (one-line addition). G-001 is now a first-invocation verify, not a blocking pre-start console step."
      },
      "security_compliance_requirements": {
        "score": 0,
        "note": "IAM + SSE-S3 + S3 Block Public Access \u00e2\u20ac\u201d no regulated compliance frameworks for PoC"
      },
      "real_time_processing": {
        "score": 0,
        "note": "Batch skill-invoked execution \u00e2\u20ac\u201d not real-time or event-driven"
      },
      "complex_business_logic": {
        "score": 0,
        "note": "Straightforward pipeline \u00e2\u20ac\u201d no conditional domain-specific rules beyond model tier selection"
      }
    }
  },
  "loe_breakdown": {
    "total_hours": 9.5,
    "total_hours_with_buffer": 12.3,
    "by_phase": [
      {
        "phase": "P-001: Foundation",
        "hours": 1.5,
        "weeks": 0.04,
        "parallel": false,
        "notes": "AI-assisted. Repo creation, directory structure, CloudFormation (S3 + IAM + Budget alarm), venv + requirements.txt, CLAUDE.md, 8 Claude Code skill stubs (.claude/skills/), .claude/settings.json hooks, .mcp.json AWS MCP servers, initial commit + push. Human gates (Bedrock console, AWS configure) are not in these hours."
      },
      {
        "phase": "P-002: Core Pipeline",
        "hours": 3.0,
        "weeks": 0.08,
        "parallel": false,
        "notes": "AI-assisted. C-002 SKU Parser, C-003 Asset Manager, C-004 Prompt Constructor, C-005 Image Generator (dev tier, 1:1 ratio, retry/backoff), C-006 Text Overlay (1:1 layout), C-007 Output Manager + manifest, C-012 Text Reasoning Engine (AnthropicBedrock). /run-pipeline skill invokes pipeline. Minimum demo state after this phase."
      },
      {
        "phase": "P-003: Output Quality",
        "hours": 2.25,
        "weeks": 0.06,
        "parallel": false,
        "notes": "AI-assisted. Extend C-005 to all 3 model tiers + image caching (~/.cache/pai-pipeline/). Extend C-006 to all 3 aspect ratios (1:1, 9:16, 16:9) with correct layouts. --dry-run mode end-to-end. Full run produces 6+ images (2 products \u00c3\u2014 3 ratios). /pipeline-status and /view-results skills functional."
      },
      {
        "phase": "P-004: CI/CD and Testing",
        "hours": 1.75,
        "weeks": 0.04,
        "parallel": false,
        "notes": "AI-assisted. GitHub Actions ci.yml (ruff lint + pytest unit tests + pip-audit on push), deploy.yml (CloudFormation deploy on main). Pytest test suite: unit tests for all 5 pipeline modules + integration test (dry-run). ruff/flake8 linting. Verify PostToolUse auto-lint and Stop test gate hooks."
      },
      {
        "phase": "P-005: Docs and Demo",
        "hours": 1.0,
        "weeks": 0.025,
        "parallel": false,
        "notes": "AI-assisted. README.md (setup, how-to-run, example I/O, design decisions, assumptions). BACKLOG.md (future roadmap). 4 demo SKU briefs in inputs/demo_briefs/. /generate-demo skill produces full demo dataset. demo-script.md. Final git tag v1.0.0."
      }
    ],
    "by_component": [
      {
        "component": "C-001 Claude Code Interface (8 skills)",
        "hours": 0.5,
        "complexity": "low"
      },
      {
        "component": "C-002 SKU Brief Parser + JSON schema validation",
        "hours": 0.5,
        "complexity": "low"
      },
      {
        "component": "C-003 Asset Manager (S3 read/write/key builder)",
        "hours": 0.5,
        "complexity": "low"
      },
      {
        "component": "C-004 Prompt Constructor",
        "hours": 0.5,
        "complexity": "low"
      },
      {
        "component": "C-005 Image Generator (Bedrock, retry/backoff, caching)",
        "hours": 1.0,
        "complexity": "medium"
      },
      {
        "component": "C-006 Text Overlay Engine (Pillow, 3 aspect ratios)",
        "hours": 1.25,
        "complexity": "medium"
      },
      {
        "component": "C-007 Output Manager (S3 + flat JSON manifest)",
        "hours": 0.75,
        "complexity": "low"
      },
      {
        "component": "C-008 IaC Stack (CloudFormation: S3 + IAM + Budget)",
        "hours": 0.5,
        "complexity": "low"
      },
      {
        "component": "C-009 Claude Code Hooks (.claude/settings.json)",
        "hours": 0.25,
        "complexity": "low"
      },
      {
        "component": "C-010 GitHub Actions (ci.yml + deploy.yml)",
        "hours": 0.75,
        "complexity": "low"
      },
      {
        "component": "C-011 AWS MCP Servers (.mcp.json)",
        "hours": 0.25,
        "complexity": "low"
      },
      {
        "component": "C-012 Text Reasoning Engine (AnthropicBedrock)",
        "hours": 0.5,
        "complexity": "low"
      },
      {
        "component": "CLAUDE.md + README + BACKLOG documentation",
        "hours": 0.75,
        "complexity": "low"
      },
      {
        "component": "Test Suite (pytest unit + integration)",
        "hours": 1.0,
        "complexity": "low"
      },
      {
        "component": "Demo data (4 SKU briefs + /generate-demo)",
        "hours": 0.5,
        "complexity": "low"
      }
    ],
    "risk_buffer": {
      "percent": 25,
      "hours": 2.4,
      "rationale": "Medium complexity (4/10): G-001 first-invocation verify (low risk \u2014 auto-enablement), Pillow coordinate tuning for 3 aspect ratios, and potential GitHub Actions OIDC/credential setup issues justify 25% buffer over PERT baseline of 9.83h. AI-assisted development partially offsets this with faster iteration cycles."
    },
    "three_point_detail": {
      "optimistic_hours": 6.0,
      "most_likely_hours": 9.5,
      "pessimistic_hours": 15.0,
      "pert_formula": "(O + 4\u00c3\u2014ML + P) / 6",
      "pert_hours": 9.83,
      "note": "Optimistic: AI completes pipeline first-pass, Bedrock auto-enables on first invocation (no wait), no Pillow iteration needed. Most likely: typical AI-assisted session with 1-2 Pillow coordinate passes and one CI/CD auth issue. Pessimistic: IAM marketplace permission missing from policy (10-min fix), Pillow text wrapping requires 3+ passes per ratio, GitHub Actions OIDC setup requires troubleshooting."
    }
  },
  "team_composition": [
    {
      "role": "AI Implementation Agent (Claude Code + Sonnet)",
      "count": 1,
      "experience_level": "expert",
      "allocation_percent": 80,
      "duration_weeks": 1,
      "hourly_rate": 0,
      "total_cost": 0,
      "responsibilities": [
        "All 12 components (C-001 through C-012): implementation, testing, documentation",
        "CloudFormation authoring and deployment commands",
        "GitHub Actions workflow authoring",
        "8 Claude Code skill files and settings.json hooks",
        "Test suite (pytest), README, BACKLOG, demo data"
      ]
    },
    {
      "role": "Paul Praeducer \u00e2\u20ac\u201d Human Architect / Decision Maker",
      "count": 1,
      "experience_level": "senior",
      "allocation_percent": 20,
      "duration_weeks": 1,
      "hourly_rate": 0,
      "total_cost": 0,
      "responsibilities": [